{
  "schemaVersion": "1.0",
  "dnaVersion": "v0.1",
  "project": {
    "brandName": "冯烫烫",
    "industry": "餐饮 / 川菜 / 跷脚牛肉",
    "category": "restaurant",
    "projectIdLocal": "dca9b7d4-f233-46ff-b4df-44a890f13c4f",
    "audience": [
      "川菜消费者",
      "周边居民",
      "午餐客流"
    ],
    "brandPositioning": [
      "地道",
      "实惠",
      "现做",
      "烟火气"
    ]
  },
  "sceneDefinition": {
    "sceneType": "reception",
    "sceneSubtype": "casual_dining_entrance",
    "commercialContext": "street_store",
    "scale": "small",
    "areaSqm": 60,
    "operatingState": "open",
    "occupancy": "medium",
    "requiredZones": [
      "reception_counter",
      "waiting_bench",
      "menu_board",
      "kitchen_pass_visible"
    ],
    "optionalZones": [
      "spice_display",
      "beverage_cooler"
    ]
  },
  "architectureDna": {
    "spatialConcept": {
      "primary": "warm_commercial_grid",
      "secondary": "kitchen_as_anchor"
    },
    "geometry": {
      "dominant": [
        "warm_tile_grid",
        "wooden_booth",
        "open_kitchen_window"
      ],
      "limited": [
        "smooth_curves",
        "all_glass_facade",
        "extreme_dimming"
      ]
    },
    "spatialContinuity": {
      "wallToCeiling": "medium",
      "floorToFurniture": "high",
      "roomToRoom": "medium"
    },
    "boundaryLanguage": {
      "hardness": "medium",
      "transparency": "medium",
      "enclosure": "hard"
    },
    "circulation": {
      "type": "guided_flow",
      "visibility": "open",
      "rhythm": "active"
    },
    "boundaryHardness": "medium",
    "statementStrength": "medium"
  },
  "functionalDna": {
    "operationalRealism": "high",
    "customerFlow": {
      "entranceToReception": "clear",
      "receptionToWaiting": "clear",
      "waitingToConsultation": "unreadable"
    },
    "furnitureRequirements": {
      "ergonomic": true,
      "commercialGrade": true,
      "accessible": true
    },
    "privacy": {
      "publicZone": "open",
      "semiPrivateZone": "open",
      "treatmentZone": "open"
    }
  },
  "brandSpaceDna": {
    "brandSpirit": {
      "scientific": 0.2,
      "elegant": 0.4,
      "healing": 0.5,
      "futuristic": 0.1,
      "premium": 0.5
    },
    "brandGrammar": {
      "organicGrowth": "low",
      "visualLightness": "medium",
      "controlledGlow": "low",
      "refinedOrder": "medium",
      "decorativeDensity": "medium"
    },
    "motifFamily": [
      "feather_like_flow"
    ],
    "literalAssetUsage": {
      "logoVisibility": "high",
      "directPeacockUsage": "low",
      "flowerSculptureUsage": "avoid",
      "crystalObjectUsage": "avoid"
    },
    "injectionStrength": 0.5
  },
  "materialDna": {
    "primaryMaterials": [
      "warm_wood_booth",
      "red_brick_wall",
      "terracotta_tile"
    ],
    "secondaryMaterials": [
      "bamboo_screen"
    ],
    "accentMaterials": [
      "brass_kitchen_fixture"
    ],
    "finish": {
      "glossLevel": "medium",
      "reflectivity": "controlled",
      "tactileQuality": "natural"
    },
    "materialCountLimit": 5
  },
  "lightingDna": {
    "primaryStrategy": "natural_lighting",
    "ambient": {
      "softness": "medium",
      "brightness": "high",
      "contrast": "medium"
    },
    "integratedLight": {
      "ceilingCove": "low",
      "wallEdge": "low",
      "furnitureBase": "low"
    },
    "brandLight": {
      "hueFamily": [
        "warm_amber",
        "red_glow"
      ],
      "saturation": "low",
      "areaRatio": "limited"
    },
    "spotlightUsage": "low",
    "decorativeFixtureVisibility": "low",
    "architecturalGlow": "low"
  },
  "compositionDna": {
    "focalHierarchy": {
      "primary": "kitchen_pass_with_chef",
      "secondary": "wooden_booth_seating",
      "tertiary": "menu_board"
    },
    "visualBalance": {
      "symmetry": "low",
      "negativeSpace": "low",
      "density": "high"
    },
    "camera": {
      "lens": "28mm_to_40mm",
      "height": "human_eye_level",
      "distortion": "controlled"
    },
    "framing": {
      "depthLayers": 3,
      "foregroundUsage": "required",
      "clearEntryView": true
    }
  },
  "renderingDna": {
    "realism": "commercial_archviz",
    "visualFinish": "natural",
    "exposure": "balanced",
    "whiteBalance": "warm",
    "shadow": "controlled",
    "textureVisibility": "pronounced",
    "people": {
      "amount": "moderate",
      "motionBlur": "preferred"
    },
    "cleanliness": "high",
    "postProcessing": "restrained"
  },
  "variationControl": {
    "preserve": [
      "warm_commercial_grid",
      "natural_lighting",
      "kitchen_as_anchor",
      "wooden_booth_pattern"
    ],
    "vary": [
      "booth_density",
      "menu_board_layout",
      "spice_display_density",
      "beverage_cooler_position"
    ],
    "motifRepetitionLimit": {
      "sameLiteralMotifPerImage": 1,
      "sameMotifAcrossBatchRatio": 0.5
    },
    "requireNovelSpatialSolution": true
  },
  "negativeConstraints": {
    "prohibit": [
      "fine_dining",
      "crystal_chandelier",
      "purple_lavender_glow",
      "white_curved_walls",
      "optical_fiber_installation",
      "translucent_fiber_decoration",
      "feather_like_flow_motif",
      "petal_like_expansion",
      "silent_atmosphere",
      "luxury_lounge",
      "high_end_clinic",
      "fashion_boutique"
    ]
  },
  "metadata": {
    "frozenAt": "2026-08-01T00:00:00.000Z",
    "frozenFromCommit": "6701ac1",
    "sourceBenchmarkIds": [],
    "promotedFromVersion": "v0.1-initial",
    "promotedBy": "Mavis (Phase 7, 2026-08-01)",
    "regressionProject": true
  }
}
